"name","numberOfGuests","roomType","stars"
"Colombo's Granbell Hotel","2","Room in hotel","4.4"
"Elephant Lake View Cabin","2","Private room in cabin",
"Giant, Ella TreeHouse","6","Treehouse",
"STAY@26 (private room near the beach)","1","Private room in guest suite",
"Beach Villa at ""Elements Beach & Nature Resort""","4","Room in boutique hotel","4.75"
"NETS Cowork Jungle Suite 1","2","Room in hotel","5"
"Comfy room with en suite bathroom + kitchen","2","Private room in guesthouse",
"Menara Villa","4","Entire home","5"
"2 Bed Luxury Apartment","4","Entire rental unit","5"
"Suite One-bedroom - Angam Suites Colombo","3","Room in boutique hotel","5"
"Unakanda Upper Garden Suite","2","Entire guesthouse","4.91"
"Luxury 3 Bedroom Mountain-View Villa, Sleeps 1-6","6","Entire rental unit","4.95"
"Blue Villa Santorini","6","Room in aparthotel",
"Beach Bliss , Nilaveli","4","Entire rental unit","5"
"The Greens Luxury Boutique Villa","8","Entire villa","4.92"
"Kalpitiya Resort on Kitesurfing Lagoon - Arasi B1","3","Room in boutique hotel",
"Goddess cheerful villa with pool","7","Private room in home","4.84"
"Mother’s Nest Villa with Pool","6","Entire home",
"Lotus Tower View Apartment","5","Entire rental unit","5"
"Sooriya Villa Mirissa","6","Entire guest suite","4.93"
"Seyansa Guest House","4","Private room in villa","4.79"
"The Rock room/ French swallow villa /ahangama","2","Private room in bed and breakfast",
"SC Galle with Pool and small kitchenette / GZ 3","2","Private room in bed and breakfast","4.95"
"Real Jungle Experience","4","Room in hotel",
"Onthree20  Residencies 2 Room  3 Beds  Apartment","5","Entire condo","4.84"
"Aliya riverside & safari resort","3","Entire villa","4.8"
"Penthouse Apartment with Sea Views & Rooftop Pool","6","Entire condo","4.7"
"Luxury Room, View & Pool @ Akway","2","Room in hotel","5"
"Villa Sun Breeze Hikkaduwa","3","Entire home","5"
"W 249","2","Entire home","4.98"
"UYANA AdultsOnly - quiet luxury suite with sofa","2","Private room in bed and breakfast","5"
"3 spacious ocean view rooms at Mamma Mia Mirissa","6","Private room in bed and breakfast","5"
"Seaview with Private Pool","2","Private room in villa","5"
"Sandalwood Cottage 02, Udawalawe","2","Private room in cottage","4.93"
"O2 Villas Mirissa- Double Room","2","Entire villa","4.93"
"Seaview room4 at Amuura Beach incl. Breakfast","2","Room in bed and breakfast","4.93"
"Sabana High-Seas Apartment","2","Entire condo",
"Modern apartment in Colombo","6","Entire rental unit","4.82"
"KOTTAWA BOUTIQUE VILLA -2 BEDROOM VILLA WITH POOL","4","Entire villa","4.83"
"DELON Ocean Front Mount Lavinia","4","Entire condo","4.59"
"cosy atmosphere | Ceylon Suite by 22 Weligambay","4","Entire condo",
"Private Room in Garden on Sea","2","Private room in guesthouse",
"Mountain View Room 06","2","Private room in home","4.71"
"Ganguli Greenery (Organic Food)","5","Entire villa","4.86"
"Bella Vita Boutique Hotel- Double Standard Room #2","2","Room in hotel",
"Green and spacious home in Colombo 5","2","Entire home",
"Lovely 2-bedroom Luxury Apartment with Pool & Gym","4","Entire serviced apartment","5"
"Seed Stay- 2 bedrooms","4","Entire home","4.86"
"Foozoo Mantra Weligama - Double Room","2","Room in boutique hotel","4.88"
"Villa for You with Excellent Breakfast.","2","Entire villa","5"
"The Breeze Residence, Kottawa","8","Entire home","5"
"Room middle of Tea Estate | Villa Tea Fields","2","Private room in villa","5"
"Villa Balapitiya Beach, SriLanka","4","Entire villa","4.66"
"Fibre Optic + Super Luxury Home for 4 Pax-Weligama","4","Entire home","5"
"Loft Ahangama room 5","2","Room in hotel","4.6"
"Lovely 2 bed Condo with a jacuzzi & rooftop pool","4","Entire condo","5"
"Spice garden with mountain view & 700m nine arch","3","Room in boutique hotel","4.7"
"Love Shack - modern beachfront apartment","3","Entire loft","4.72"
"Whitemanor    (Studio flat)","2","Entire rental unit","4.93"
"Room Four at The Yard","2","Private room in guesthouse",
"Kandy Villa_ Hindagala Retreat/Boutique V_ entire","6","Entire villa","5"
"The Palm Lanka - SUITE 4","2","Private room in home","5"
"The Deco House-COTTAGE","3","Private room in bed and breakfast","5"
"Nalu Mirissa Superior Suite mit Balkon 43","2","Room in hotel","5"
"plantation | 1-bedroom eco chic villa | Weligama","2","Entire villa",
"Dickwella Green Villa","5","Entire home","5"
"Eco Home weligama bay double room","2","Private room in villa","5"
"Aminva Boutique Villa~ 1 Family Suite Room 25%off","4","Private room in home","4.98"
"Panoramic Colombo views","4","Entire rental unit","4.97"
"Paddy Perch Studio “Rest + Digest”","2","Tiny home",
"Ocean Breeze Serviced Studio Apartment Negombo","2","Entire rental unit","4.78"
"Saku Residence","4","Entire villa","5"
"Moon Isle Beach Cabaña, Nilaveli","2","Private room in bungalow","4.95"
"Villa Jungle & Wiener","2","Room in hotel",
"D Canal House - Bungalow  Haliconia","2","Entire bungalow","4.86"
"Tropical holiday home I 2 BR I Garden I Beach 150m","5","Entire cottage","5"
"Elisian Residency-4B Apartment","4","Entire rental unit","4.83"
"Ella Retreat Glamping Tent on Hill - Nature Lover","2","Tent","5"
"PALM VILLA MIRISSA N°1, double room AC ocean view","2","Room in hotel","4.96"
"The Frame (Sun Rise View)","2","Private room in villa","5"
"Tree House Birders’ Nook. Galkadawala Forest Lodge","5","Treehouse",
"The Jungle view, Super deluxe double room 1","2","Private room in bed and breakfast","4.92"
"Beautiful villa with pool 70m from Mawella beach","6","Entire villa","5"
"Eco friendly secluded villa with infinity pool","7","Entire villa","4.77"
"Ella Mount View Guest Inn Deluxe room_2","6","Private room in bed and breakfast","4.81"
"Luna Laguna, Kalpitiya: Junior Suite","2","Room in boutique hotel","5"
"Black Cat STAY King Room 3","2","Room in bed and breakfast","4.78"
"D Canal House - Bungalow Hibiscus","2","Entire bungalow","4.82"
"Entire Villa, Pool+Kitchen By Thaprobana Villa","4","Entire villa","4.77"
"ARALIYA-3 BEDROOM  HOUSE WITH POOL IN KOTTE","6","Entire home","4.86"
"Sunsara Villa","6","Entire home","5"
"MOND Treescape 'Waxing' - Hiriketiya Beach","2","Treehouse","4.89"
"Villa Arali (Private Villa with Swimming Pool)","5","Entire villa","4.81"
"Gitano Surf • Queen room 2","2","Room in hotel","5"
"VAUX Park Street 3 Bedroom Lofts 125m2","6","Entire serviced apartment","5"
"Room in Villa in Ahangama","2","Private room in bed and breakfast",
"Villa River Breeze","4","Entire villa","4.71"
"Kook's Paradise Villa | Private Room #4","2","Private room in guesthouse",
"CASA MARIA MIRISSA, Family GROUND floor room No1","4","Room in boutique hotel","4.97"
"Eagles Falls Villa - Victoria Golf & Country Club","8","Entire villa","5"
"Holiday Apartment in Colombo","6","Entire condo","5"
"Seven Pillars, a 3 bedroom villa in Galle Fort","6","Entire home",
"The Frame","4","Entire villa","4.86"
"IntimAte Jungle Bungalow with Pool 10 min to Beach","2","Room in boutique hotel","4.96"
"Windgate Estate Bungalow","10","Entire villa",
"Villa Wild Air","10","Entire villa","5"
"TROPICAL HOUSE Jungleside Villa","2","Room in boutique hotel","5"
"Surf & Relax: Lux Room, Full Service","2","Room in hotel",
"The Papaya Pad - Villa","8","Entire villa","5"
"Luxury condo on the Beach with stunning Sea Views","5","Entire condo","5"
"Blue Sails Nilaveli《 Beach, Pool, Kitchen & Grdn 》","6","Entire condo","4.96"
"Luxery Modern Villa with magnificent views","4","Entire villa",
"The Chocolate Factory House, Kandy","4","Entire rental unit","5"
"Villa Sūrya Bolgoda Lake","9","Entire villa","4.97"
"Luxury smart private room in kandy with pool GF","3","Private room in bed and breakfast","4.95"
"Casa Komune | 4 Bedroom Villa | Hiriketiya Beach","8","Entire villa","4.8"
"Stunning Galle Fort Villa","6","Entire villa","4.98"
"Capitol Twinpeaks","4","Entire rental unit","4.82"
"Peaceful villa in the jungle, 3 Ensuite Bedrooms","6","Entire home","5"
"KAJU GREEN Eco lodges","2","Private room in resort","4.87"
"Ballarat Luxury Villa - Hikkaduwa","6","Entire villa","4.89"
"PALM VILLA MIRISSA N°15, beautifull room sea view","2","Room in hotel","4.91"
"Upper Room in the Tropical Trees","2","Private room in bungalow",
"Luxury Beachfront Condo In Uswetakeiyawa, Colombo","3","Entire condo","4.9"
"Ella Treehouse, Duplex 5","5","Entire place","4.78"
"Lovely bungalow with luxury amenities in a jungles","2","Private room in resort","4.9"
"Loft Ahangama room 7","2","Room in hotel",
"VAUX Park Street 2 Bedroom Lofts 85m2","4","Entire serviced apartment",
"Flowground | Paddy Room","2","Private room in home","5"
"Stunning Sea View Room with Direct Beach Access","2","Room in boutique hotel","5"
"The Nook Resort - Pool View II","2","Room in boutique hotel",
"Arawe Villa","4","Entire guesthouse","5"
"8th Heaven at Treasure Trove","4","Entire condo","5"
"Budtt Farm","2","Entire villa",
"Drift House - Beach Villa 2","4","Entire villa","4.94"
"Negombo Bliss on the Beach Luxury Suites (Seaview)","2","Entire rental unit",
"Into The Blue - Yoga included | Walk to Beach","2","Private room in guest suite","4.86"
"Hiriketiya Beach V1 New King Size Villa","2","Entire guest suite","4.9"
"The Cottage","3","Entire cottage","4.93"
"Sinhala beach villa","4","Entire home",
"Luxury Suite Ahangama Sri Lanka","2","Room in hotel",
"Ahangama Hotel Room Near Galle / Weligama","2","Private room in bed and breakfast","5"
"Bright New Central Apartment","4","Entire rental unit","4.98"
"SPACE Double Room with Ocean View","2","Room in boutique hotel","5"
"Square Peg (Vista 1)","2","Room in boutique hotel","4.9"
"Ella Retreat - Glamping Tent for Nature Lovers","2","Entire place","4.85"
"Sailors' Bay Sea view Family room","4","Private room in bed and breakfast","4.98"
"Luxury villa with ocean and jungle view  Unakuruwa","4","Entire villa","5"
"Sea View Luxury Apartments","2","Entire rental unit",
"Apex Surf house~AC~Free surf bord","2","Entire home","4.9"
"Maria Bonita Casa & Café Queen Room 5 AC","2","Private room in home","4.87"
"Beach view stylish 2 br pool villa ~ Jungle~ Surf","4","Entire home","4.8"
"The Tree Retreat - huge pool, playground & garden","6","Entire villa","5"
"Nalu Mirissa Junior Suite mit Balkon 42","2","Room in hotel","5"
"Sisters Kabalana King Room 1","2","Entire condo","5"
"Shalini Villa","6","Entire villa","4.94"
"Kingfisher at Khomba Lodge","4","Entire rental unit","4.9"
"Altair Colombo - View, Location, Ultra Luxury!","6","Entire condo","4.89"
"Luxury Suite Ahangama Sri Lanka","2","Room in hotel","5"
"Square Peg (Industrial Loft 4)-Garden View","4","Entire loft","4.88"
"The Nook Resort - Garden View I","2","Room in boutique hotel",
"AMMA Boutique Hotel R/1","2","Room in hotel","5"
"Spacious Suite w/ Pool in Villa","2","Private room in vacation home","4.75"
"Seagulls Garden -450 m to beach & Free* Utility","5","Entire home",
"Kesmika Seaside Apartment","2","Entire rental unit","4.89"
"MOND - Hiriketiya Beach - Room 3","2","Room in boutique hotel","4.88"
"Tranquil 3BD Villa in Kabalana","6","Entire home","4.83"
"Nomads Colive - Lakeside Garden Lodge","2","Entire rental unit","4.86"
"Banyan Camp- Champagne Lodge","4","Earthen home","4.86"
"MAKAI Surf House - Deluxe Room w/ Balcony","2","Private room in guesthouse",
"VILLA SANARA Absolute Beach Front Colombo North","6","Entire villa","4.85"
"stay same like your home","2","Entire rental unit","5"
"Spacious Suite w/ Pool & Kitchen","2","Private room in guesthouse","5"
"Beach_TRIGON 3 / tinyhouse / co_living","2","Tiny home",
"Peacock Hill - Family Estate","4","Farm stay",
"Dolce Vita Surf Resort","2","Private room in home",
"The Monkey Cottage' Hidden in jungle, Near Beach","2","Entire cottage","5"
"La kurumba 
Вилла на берегу океана🏝️","2","Private room in villa","5"
"Beach Villa I 3 BR I Garden I Beach 5 m","6","Entire home","4.89"
"Villa sunrise unawatuna","2","Entire villa","4.94"
"Best Condo in Colombo - Rare Find","4","Entire condo","5"
"Knightsbridge Grand Apartment","4","Entire rental unit","5"
"Oasis in the city-pool-prime location-Unit B","4","Entire rental unit","4.98"
"Winwood Ella Deluxe family room","4","Private room in guesthouse","5"
"Family room at Villa Noumi","4","Private room in home",
"UYANA AdultsOnly - quiet luxury suite with balcony","2","Private room in bed and breakfast",
"AMANTA BEACH (Standard Double Room)","2","Room in boutique hotel",
"Sandalwood Cottage 01, Udawalawe","2","Private room in cottage","4.87"
"Apartment Ocean Front Condominium 04 07 A","4","Entire vacation home","5"
"Sri Mathie B&B | Forest House","2","Private room in bed and breakfast","5"
"The Banda' Eco Villa (Tree House)","4","Treehouse",
"White House weligama Contact: (-0702808565-)","2","Entire home",
"Quiet double room with Patio","2","Private room in home",
"PentOn45 - Luxury Penthouse Apartment","6","Entire rental unit","4.71"
"VillabyAQ","6","Entire villa",
"The Forest's Last Stand - Galle","2","Entire villa","4.89"
"Ali Adi Eco Lodge","4","Private room in nature lodge","5"
"Coco Garden Villas - Villa 01","2","Entire home","4.95"
"33 Lake Terrace - Twin Room 'Laaksha'","2","Room in boutique hotel",
"2 bedroom Cosy apartment","4","Entire rental unit","5"
"Enjoy your stay.","2","Room in hotel",
"Dilena Homestay","2","Entire condo","5"
"Palm House at ""Elements Beach & Nature Resort""","2","Room in boutique hotel",
"Negombo Bliss on the Beach Luxury Studio
(SeaView)","2","Entire rental unit","5"
"The Palm Lanka - SUITE 1","2","Private room in home","4.71"
"Lavonca Boutique Hotel - Standard King Room","2","Room in hotel","4.79"
"Aliya Riverside & Safari Resort - Wooden Cottage","2","Private room in cottage","4.69"
"Villa 948 Beach Front with Pool","6","Entire home","4.79"
"The Down South / Ahangama","2","Private room in villa","5"
"Tree House - Midigama","2","Treehouse","4.97"
"Hotel Room in Madiha","2","Room in hotel","5"
"Modern, Luxury, private villa.","4","Entire rental unit","4.91"
"Room Three at The Yard","2","Private room in guesthouse","5"
"Villa Sweylon","4","Entire condo",
"Beach_TRIGON 1.1 / tinyhouse / co_living","2","Tiny home",
"Banyan Lodge, Udawalawe","6","Private room in earthen home","4.85"
"sigiriya village home stay1","2","Entire home","4.89"
"Tiny House-work space-rooftop pool-The Loft","2","Tiny home","4.9"
"Gracian Villa B&B Spacious Room with Pool Access","2","Private room in home","4.94"
"Sigiri Tree House","2","Entire bungalow","4.89"
"Sri Mathie B&B | Garden Room","2","Private room in bed and breakfast","5"
"Sunborn Studios, Ahangama","4","Entire home",
"Attic Room with Tea View | Villa Tea Fields","2","Room in nature lodge","5"
"The Seed","4","Entire home","4.87"
"Srilax - Double Room (The One)","2","Private room in home","4.91"
"Smile Hub Kandy (Private Single room)","1","Private room in home",
"Whisky Point Resort - Ocean View Open Air Pagoda","2","Private room in resort","5"
"Villa Escape to Tranquility- The Nest","4","Entire cottage","5"
"Redwood Falcon","2","Farm stay","4.82"
"Room in Villa in Ahangama","2","Private room in bed and breakfast",
"Magical Tree House in Jungle next to Pidurangala","4","Private room in treehouse","4.85"
"Negombo Morawala Beach Villa","4","Entire home",
"Wild Resort Ella - Chalet 2 With pool","2","Entire chalet","4.76"
"Pool & Garden w/ 50+ BIRD Nests! in Palm Tree!","6","Entire villa","4.87"
"STAY@26 (Private Room near the beach)","2","Private room in guest suite","4.73"
"Private Beach I Ocean View I Surf I Yoga I Calma","2","Room in boutique hotel",
"Coconut Cabin - Hiriketiya Beach","2","Entire cabin","4.75"
"Villa 232 - The Boat House - Dutch Bay Trincomalee","4","Entire home","4.9"
"Spark Bridge-Colombo, an artist-designed 3BR condo","6","Entire condo","5"
"Square Peg (Vista with private alfresco Jacuzzi)","2","Room in boutique hotel","4.92"
"Beach Blessing -Uswetakeiyawa","2","Entire condo","4.87"
"The SeDi Villa","6","Entire villa","4.78"
"Black Cat STAY King Room 4","2","Room in bed and breakfast","4.79"
"Verse Collective | Palm Suite | Dickwella","2","Room in boutique hotel","4.74"
"Dreamtime Plunge Pool Cabana 2","2","Private room in bed and breakfast","4.85"
"The Rez by Verse | Apartment 01 | Hiriketiya","2","Entire serviced apartment","4.83"
"Serenity villa upper floor","4","Entire home","5"
"Skyline Suite at Rooftop Villa","2","Private room in bed and breakfast",
"Ella Treehouse, Duplex6","6","Private room","4.84"
"Villa Mount Melody Kandy","8","Entire villa","4.94"
"Studio Ascot: An Intimate Bungalow","2","Entire rental unit","4.94"
"Galkadawala Forest Lodge, Habarana. (c)","3","Private room in treehouse","4.9"
"Beach flat with private garden","4","Entire rental unit","5"
"Gitano Surf • Queen room 1","2","Room in hotel","4.91"
"Ella Panorama Villa - Luxury Family Room","2","Entire guesthouse","5"
"The Neylipz/ 3Bed Apartment/Fully Air Conditioned","6","Entire rental unit","5"
"Villa Ananya","6","Entire home","4.89"
"Twin Peaks residence","4","Entire rental unit","4.9"
"Sri Mathie B&B | Pool Room","2","Private room in bed and breakfast","5"
"Pool room at Villa Noumi","2","Private room in home",
"An exquisitely designed  condo at Havelock City","4","Entire serviced apartment","5"
"Dolce vita surf rest point","2","Private room in guesthouse","5"
"Jungle Paradise Hotel","2","Room in boutique hotel","5"
"Iconic Home Stays
28th Floor, Iconic Galaxy.","4","Entire condo",
"Stylish 2BR Oasis: Lake & Skyline views in Colombo","4","Entire condo","4.91"
"Casa Maria Mirissa, prety room AC & balcony N7","2","Room in boutique hotel","4.67"
"Fully Luxury AC Apartment by O2 Villas Weligama","4","Entire villa","5"
"Romance in Ella","2","Private room in bed and breakfast","4.68"
"Ella Retreat Cottage for Nature Lovers","2","Earthen home","4.8"
"Luxurious Kingsize Double Bedroom with Fab Views.","2","Private room in bed and breakfast","5"
"Tropical Garden Bungalow - (300m to beach)","3","Entire home","5"
"Villa Aranya-2 bedroom-Private Pool-Madiha","4","Entire home","4"
"Relax in Style: Private & Staffed","2","Room in hotel",
"The Palm Lanka - SUITE 3","2","Private room in home",
"Lavonra   ""The Luxury Living meets Natural Beauty""","4","Entire villa","5"
"NAKED villa - Luxury Villa in Galle area.","6","Entire villa","4.71"
"Sunyata Studios Sri Lanka","4","Entire home","4.69"
"Blue Beach House (Room 1)","2","Private room","4.83"
"Gracian Villa B&B Room with Mountain View","2","Private room in bed and breakfast","5"
"Ella Treehouse, 2 levels wooden cabin","5","Entire place","5"
"Panta Rei Resort Family villa","4","Room in hotel","4.8"
"The Rez by Verse | Apartment 05 | Hiriketiya","2","Entire serviced apartment","4.83"
"Gracian Villa B&B Large Room with Mountain View","4","Private room in bed and breakfast","4.95"
"Claire Villa - Master King Suite & Luxury Bath","3","Private room in villa","4.95"
"Room Five at The Yard Hiriketiya","2","Private room in guesthouse","5"
"Turquoise Fort House with ocean view & solar power","4","Entire home","4.86"
"Lighthouse Ahangama, So Suite 1","3","Room in boutique hotel","5"
"VS Spacious suite + private plunge pool","2","Entire villa","4.96"
"Apartment in Colombo: Cozy Two Bedroom Apartment","4","Entire home","5"
"Sōmar - Luxury Suite A Few Steps From The Beach","2","Room in boutique hotel","4.86"
"Room Two at The Yard","3","Private room in guesthouse","5"
"Riverside Retreat: Cozy space, Endless views","2","Private room in bed and breakfast","4.8"
"Luxury 5 Bedroom Villa with Pool & Jacuzzi","9","Entire villa","4.8"
"Amazing Private Boutique Villa","6","Entire villa","4.86"
"Duma Beach House Beach View & Private pool","6","Entire villa","5"
"Incredible Mirissa Views : Luxury & Staffed","2","Room in hotel","5"
"Tropical Bungalow- 1 bedroom","2","Entire bungalow","4.98"
"The Bungalow at Karma House.","2","Entire bungalow","5"
"Beautiful Beachfront Villa- Lumi Villa","6","Entire villa","4.84"
"Sōmar - 2-Bedroom Villa Near The Beach","4","Entire villa","5"
"The Deluxe Suite - SHOCKING View","2","Entire guesthouse","4.94"
"Peaceful small room with balcony","2","Private room in home",
"Family beach house w/ pool  - Madiha, South coast","6","Entire villa","4.84"
"Stylish peaceful 1B Villa with a private pool","2","Entire villa","4.85"
"Peaceful B&B with infinity pool: OceanEye #2","2","Private room in bed and breakfast","4.94"
"Kurunduketiya Private Rainforest Resort","4","Entire villa","4.89"
"Banyan Camp- Wine Lodge","4","Earthen home","4.9"
"SWEET VILLA","7","Entire villa","5"
"Drift House - Beach Villa 1","4","Entire villa","4.96"
"The Nook Resort - Pool View I","2","Room in boutique hotel","5"
"Nalu Mirissa Superior Suite mit Balkon 45","2","Room in hotel","5"
"Unique Tree House two floors- Jaywa Lanka Tangalle","3","Private room in nature lodge","5"
"Square Peg (Industrial Loft 1)-Garden View","4","Entire loft","4.9"
"Orchid Dream Bed & Breakfast","3","Private room in bed and breakfast",
"Yunal inn, 15 bed rooms with attached bathrooms .","16","Private room in home",
"Arlo's Place Hiriketiya","4","Entire rental unit","4.92"
"Arachchi heritage - lake view and architect design","3","Room in boutique hotel","4.94"
"Luxury Private Villa With Pool In Ahangama","4","Entire villa","4.91"
"Panta Rei Resort Suite","2","Room in hotel","5"
"Arachchi Heritage","3","Private room in guesthouse","5"
"Stay Golden Premium Cabana with Sea View","4","Room in boutique hotel","5"
"The Backyard  Dethanagala A Frame Lodge","5","Private room in nature lodge","4.9"
"La Sanaï Villa - Paddy Island","4","Entire villa","5"
"The Nook Resort - Garden View II","2","Room in boutique hotel","5"
"To sale Antique House","4","Entire home",
"Quiet Luxury Retreat: Fully Staffed","2","Room in hotel","5"
"Hiriketiya Beach V3 New King Size Villa","2","Entire guest suite","4.93"
"Stunning luxury private villa with unique sea view","4","Entire villa","4.86"
"The Cactus Pad ~ Wifi ~ AC ~ Hiriketiya","2","Entire vacation home","4.84"
"Marigold Gedara (Marigold House)","4","Entire villa","4.94"
"Dimidi villa","2","Private room in home",
"Srilax - Deluxe Double Room (The Nook)","2","Private room in home","4.86"
"MOND - Hiriketiya Beach - Room 1","2","Room in boutique hotel","4.92"
"Beachfront Villa Madiha - Abhaya Villas","2","Entire home","5"
"Cinnamon Villa","6","Entire home",
"Superb Dorm room close to train Station","1","Room in boutique hotel","4.53"
"Verse Collective | Peacock Suite | Dickwella","2","Room in boutique hotel","4.79"
"Pavilion Garden House","2","Entire villa","5"
"Alokaya House, Ahangama","6","Entire home",
"Indigo Apartment","3","Entire rental unit","5"
"bernads home","2","Private room in bed and breakfast",
"Square Peg (Vista 2)","2","Room in boutique hotel","4.93"
"Mercedes Lodge","2","Private room in nature lodge","4.92"
"Stay peace in Chill House Hostel","1","Shared room in bed and breakfast",
"Stylish lakefront safari villa with pool near Yala","9","Entire villa","4.95"
"Lake Villa by CarlSen","6","Entire villa","4.88"
"LANKAPURA HERITAGE HOTEL","4","Room in boutique hotel","4.88"
"Jungala - Boutique home with a private waterfall","3","Private room","5"
"AC, Non-AC rooms with shared bathroom","2","Private room in home",
"Flexible destination between Mirissa & Weligama","6","Entire villa","4.96"
"Dreamtime Plunge Pool Cabana 1","2","Private room in bed and breakfast","4.96"
"Hibiscus House-AC, FiberWi-fi,2beds","4","Entire home","4.83"
"Orchid Dream Bed & Breakfast","3","Private room in bed and breakfast",
"Spacious Suite w/ Pool, Kabalana","2","Private room in guesthouse","5"
"“Roshe” in Capitol TwinPeaks!","4","Entire rental unit","5"
"Loft Ahangama Suite","2","Room in hotel",
"Luxurious 3BR Apartment on the 32nd Floor!","6","Entire rental unit","4.98"
"Relax Holiday Villa in Midigama","2","Private room in villa",
"33 Lake Terrace - Twin Room Batik","2","Room in boutique hotel","5"
"Higher Ground Treehouse Ella140sqm over 2 levels","6","Treehouse","4.78"
"Sea La Vie Colombo","6","Entire rental unit","4.98"
"Moon Isle Beach Bungalow Nilaveli Triple room 3bed","3","Private room in bungalow","4.86"
"Villa 234 - The Kovil House-Dutch Bay Trincomalee","3","Entire home","4.92"
"Entire Boutique Villa With Pool (PEARL)","6","Entire villa","5"
"The Palm Lanka - SUITE 2","2","Private room in home",
"CASA MARIA MIRISSA, double room No7 in the villa","2","Room in boutique hotel","4.92"
"Secret Paradise","2","Entire bungalow","4.93"
"Jungle Paradise Hotel","4","Room in boutique hotel","4.9"
"The Kip B&B  | Deluxe Queen Room","2","Room in bed and breakfast","4.96"
"D Canal House - Bungalow Wathsudda","2","Entire bungalow","5"
"68 By Month","4","Entire villa","4.83"
"Luxury Suite with ocean and jungle view Unakuruwa","3","Entire guest suite","4.98"
"Hiriketiya Beach V2 New King Size Villa","2","Entire guest suite","4.92"
"Idle House, an Enchanting Hideaway near Galle","6","Entire home",
"Ocean View, Best Place be at night","4","Shared room in hostel",
"The Takamaka Tree","4","Entire home","5"
"Ultramodern Riverfront Villa-2 Rooms/Infinity Pool","5","Private room in villa","4.72"
"Square Peg (Vista with private Jacuzzi)","2","Room in boutique hotel","4.91"
"atha resort sigiriya","2","Room in boutique hotel","4.94"
"Ella Mount View Guest Inn Deluxe room_1","2","Private room in bed and breakfast","4.75"
"Skyridge Cabin","2","Entire cabin","5"
"Private Beach I Surf I Secret Paradise I Calma","2","Room in boutique hotel","5"
"Studio Aurora","3","Entire rental unit","4.97"
"Sōmar - Luxury Suite A Few Steps From The Ocean","2","Room in boutique hotel","5"
"Monsoon Eco-Resort  - Arugam Bay ( Chalet )","3","Tiny home","5"
"Villa Seven-Faces for a couple or a family","5","Entire villa","4.96"
"Sobaya Bungalow","2","Private room in bungalow","4.89"
"The Spice House, Mirissa","2","Private room in guesthouse","4.92"
"Hiru Lagoon Negombo","2","Private room in bed and breakfast","5"
"Jungle Paddy View Guesthouse “ Rest + Digest”","2","Entire guesthouse","5"
"Swell Shacks OCEAN VIEW ROOM- Madiha Beach, Matara","2","Private room in bed and breakfast","5"
