"name","numberOfGuests","roomType","stars"
"D'Villa Garden House","2","Private room in guest suite","4.61"
"Suppar villa, a vacation home","6","Entire home","4.5"
"Relaxing 2 BR home closer to Nallur temple","4","Entire vacation home",
"Brinthavanam days inn /Non Ac/Free Veg Break fast","2","Private room in guesthouse","4.44"
"Lone Star Residence","6","Entire home",
"Valli Farm Stay with a view and fun Activities","3","Farm stay",
"SATK INN - Deluxe Family Room","3","Room in hotel",
"One bedroom apartment","3","Private room in condo",
"Charming 1 Cabana Resort with Pool","4","Private room in resort",
"""Mathura"" Home / Two rooms for rental in Jaffna","4","Entire home","4"
"abi holiday home - private villa -jaffna","6","Entire villa",
"Thikal Kudisai- Private Room 01","3","Private room in villa",
"K.P.K Farm House","3","Hut",
"village house in the nature","4","Entire home",
"J. R. Thacxhana Mahal - Main Floor / 1st Floor","6","Entire home",
"Malabar Home Stay Jaffna","7","Entire vacation home",
"Vannarpannai Properties (new close to Jaffna Town)","5","Entire rental unit",
"Ponrose Villa - 8 bed rooms","16","Entire villa",
"Located close to town centre","4","Entire condo",
"AJR Guest House Jaffna","7","Entire townhouse",
"Hari Guest House-One room without A/c 2sleeps","2","Private room in home",
"Shylla Villa - Nature House","10","Entire home",
"Hari Guest House Full house with 6bedroom-15sleeps","16","Entire villa",
"Hari Guest House _ Three bed room first floor","9","Private room in villa",
"Hari Guest House Family kingsize Bed Room with A/c","5","Entire villa",
"J Hotel","15","Room in hotel",
"Tony's Garden House 🏡 inn","16","Private room in home","4.08"
"Jaffna Eco Resort","8","Private room in villa",
"Hari Guest House _ Three rooms in Ground Floor","8","Private room in villa",
"Spacious Full House Rental","8","Entire home",
"Deya's Villa","8","Entire home","4"
"Jaffna retreat","6","Entire home",
"lovely","2","Private room in home",
"Neverbeen to Sarras Guest House | DBL Room 1","2","Private room in guesthouse",
"Jamuna Villa","16","Room in hotel",
"Logement entier proche Nallur","8","Entire home",
"Neverbeen to Sarras Guest House","2","Private room in guesthouse",
"Near the jaffna Hindu college","11","Entire rental unit",
"""Mathura"" Home/ Holiday home for rental in Jaffna","10","Entire home","4"
"Cottage Thamor 2 Bedroom unit","9","Private room in home",
"A Traditional Villa with Garden","13","Entire villa","4"
"Kilner Lane Guest House","10","Entire home",
"New house near Nallur Kovil","5","Entire home",
"Thirumalarakam Holiday House","8","Entire home",
"One private room in Nallur Jaffna","3","Private room in home",
"Happy Moon Villa","12","Entire guest suite",
"Charming 10 Bed Room Cabana Hotel with Pool","4","Private room in resort",
"shayle guest Inn (@ Nelliady town)","14","Private room in rental unit",
"Welcome Stay Inn Hotel- Jaffna.","16","Private room in home",
"JR Thacxshana Mahal - 3rd-Floor - Room-3","2","Private room in rental unit",
"BRIGHTINN","2","Room in bed and breakfast",
"Charming 10 Bedroom Cabana Resort with Pool","4","Room in boutique hotel",
"Thaarahai Guesthouse","10","Entire guesthouse",
"Brinthavanam days inn/Veg break fast free","2","Private room in guesthouse",
"Yal's Town Inn 
Bed & Breakfast","2","Room in hotel",
"Good place to enjoy your holiday","7","Entire home",
"""Mathura"" Home/ Twin room C for rental in Jaffna","4","Private room in home",
"Welcome to Paradise House including  a Well.","10","Entire home",
"Quite place to enjoy your trips!","4","Entire home",
"Shan villa","6","Entire home",
"House for rent nunavil jaffna","4","Entire home",
"NILUMA Residence","4","Private room in bed and breakfast",
"The PalmAram - Guest house A & Restaurant","7","Entire guest suite",
"The Premier Villa - Private Room 3","3","Private room in villa",
"Home in  Delft Island, Jaffna","6","Entire home",
"J. R. Thacxhana Mahal  2nd Floor","6","Entire home",
"JR Thacxshana Mahal 3rd-floor Room-2","2","Private room in rental unit",
"Thikal Kudisai - Private room 02","4","Private room in villa",
"Shamuga Vaasam","8","Entire home",
"Brinthavanam days inn/ Veg break fast free","2","Private room in guesthouse",
"JR Thacxshana Mahal - 3rd-floor - Room-1","2","Private room in rental unit",
"The PalmAram - Guest house B & Restaurant","7","Entire guest suite",
"A/C Room in a Holiday House","3","Private room in home",
"Quadraple Room with Private Bathroom","4","Private room in home",
"JR Thacxshana Mahal -3rd Floor","6","Entire home",
"It is a good place for holiday.","7","Entire cottage",
"Thikal Kudisai","14","Entire villa",
"Mr Jey","3","Entire rental unit",
"Charming 10 Cabana Resort in Iayakachi Jaffna","4","Private room in resort",
"Thikal Kudisai - Private 05","3","Private room in villa",
"Newly built House beach view","8","Entire home",
"Thikal Kudisai - Private 04","3","Private room in villa",
"one bedroom apartment","2","Private room in rental unit",
"Berty's Cottage Family Room","3","Private room in bed and breakfast",
"The Premier Villa - Private Room 5","4","Private room in villa",
"Jaffna’s King Rooms","2","Private room in home",
"Hari Guest House- One Room A/c 3 sleeps","2","Private room in home",
"Geesh Residence in Central Jaffna (Apartment)","8","Entire serviced apartment",
"Thikal Kudisai - Private 03","3","Private room in villa",
"VipuVinu House 70","4","Entire home",
"""Mathura"" Home/ Twin room A for rental in Jaffna","2","Private room in home","4.3"
"Superior Deluxe Room Only","3","Room in hotel",
"Superior Deluxe Room with Bed & Breakfast","3","Room in hotel",
"""Mathura"" Home/ Twin room B for rental in Jaffna","2","Private room in home",
"""Jaffna Village"" Courtyard House","6","Entire home",
"Sunflowers Canada House, Entire House","14","Entire home",
"Paradise Guest house including a Well","2","Private room in guesthouse",
"House in Nelliady for daily & short term stays.","4","Entire guesthouse",
"Feel like home","2","Private room in bed and breakfast",
"The Premier Villa -Private Room 1(Budget)","1","Private room in home",
"Mangotree Homestay","2","Private room in home","5"
"Standard Room with Bed & Breakfast","2","Room in hotel",
"Sunflowers Canada House, Montreal and Ottawa Rooms","4","Private room in home",
"Charming 10 Cabana Resort with Swimming Pool","4","Private room in resort",
"Charming 10 Bed room Resort with Pool","4","Room in boutique hotel",
"AC Bedroom in Holiday home","2","Private room in home",
"Charming Resort with Pool","4","Private room in resort",
"Deluxe Room Only","3","Room in hotel",
"Sunflowers Canada House, Entire Main Floor","7","Entire home",
"DAJ Bungalows","8","Private room in bungalow","4.43"
"SATK INN - Standard Family Room","3","Room in hotel",
"Sunflowers Canada House, Edmonton & Calgary Rooms","4","Private room in home","5"
"Standard Room Only","2","Room in hotel",
"Cottage Thamor 3 Bedroom Unit","15","Private room in cottage","4.71"
"Sunflowers Canada House, Calgary Room","2","Private room in home","5"
"Nallur Luxurious  5 bedroom fully renovated Villa!","10","Entire villa","4.57"
"Quadraple Room with Shared bathroom","4","Private room in rental unit",
"Sarra's Villa (2)","2","Private room in villa",
"Engel Apartment jaffna","10","Entire home",
"""Mathura"" Home / Three rooms for rental in Jaffna","6","Entire home","4"
"Rajeevan Garden Guest House (Upstairs)","10","Entire home",
"Vishal Villa","10","Entire villa","4.75"
"Peaceful fully airconditioned room in Nallur","2","Private room in vacation home",
"Berty's Cottage Double Room","2","Private room in bed and breakfast",
"Neverbeen to Sarras Gatetrees | Deluxe Room1","2","Private room in villa","4.25"
"Sunflowers Canada House, Ottawa Room","2","Private room in home",
"Crossette Villa","11","Entire home","4.23"
"Luxury House in Nallur","4","Entire home",
"Deluxe Room with Bed & Breakfast","3","Room in hotel",
"we are family base hotel jaffna.","16","Room in hotel",
"Sunflowers Canada House, Vancouver Room","3","Private room in home","4.82"
"The Premier Villa - Private Room 4","2","Private room in villa",
"Rajeevan Garden Guest House","10","Entire home","4.75"
"Cottage Thamor 1 Bedroom unit","4","Private room in home",
"The Premier Villa -Private Room 2","3","Private room in villa",
"Neverbeen to Nallur Residence | Double Room BB","2","Private room in villa",
"ENGEL Villa Jaffna","10","Private room in villa","4.5"
"Brinthavanam days inn  (Vege break fast free)","2","Private room in guesthouse","4.6"
"Villa de luxe avec piscine","10","Entire home",
"Appartement de luxe avec piscine","6","Entire rental unit",
"Villa in Jaffna, Ariyalai","6","Entire home","4.8"
"Short break Luxury Flats","4","Entire rental unit",
"Sunflowers Canada House, Toronto Room","3","Private room in home","4.67"
"Villa in Kalviyankadu","6","Entire home",
"Whiterock Villa","8","Private room in home",
"Kokuvil Villa","14","Entire home",
"NEW VILLA - 2 Floor | A/C - and non A\CPoint Pedro","10","Entire home",
"Beautifully presented holiday home in Jaffna","6","Entire home",
"Sunflowers Canada House, Edmonton Room","2","Private room in home","5"
"Luxurious Villa in Jaffna","5","Entire home",
"Matheera Holiday Home","12","Entire guesthouse",
"Berty's Cottage Single Room","1","Private room in bed and breakfast",
"Hajiz Palace","12","Entire home","4.67"
"Abi Villas in central Jaffna","6","Entire home","4.67"
"Luxury flats for a short break","4","Entire rental unit",
"SATK INN - Double Room","2","Room in hotel",
"The Premier Villa","12","Entire villa","4.96"
"Luxury A/C & Non A/C Room HOTEL","16","Entire bed and breakfast","3.6"
"Calming atmosphere in a Sri Lankan village","4","Private room in bungalow",
"Rose Fort Homestay","6","Private room in rental unit","5"
"Sunflowers Canada House, Entire Upper Floor","7","Entire home","5"
"AJR - Sivaston Guest and Function Hall","9","Entire townhouse",
"Delft beachfront Villa","2","Private room in bed and breakfast",
"Cheerful 4-Bedroom bungalow in Velanai","10","Entire bungalow",
"Welcoming village 1-bedroom bed and breakfast .","2","Private room in bed and breakfast",
"D'Villa Guest House","2","Private room in guesthouse","4.73"
"Sunnyville","8","Entire bungalow",
"Most Spacious, Luxurious கனி Guest Suite in VVT","10","Entire guest suite","4"
"Vacation Villa in Jaffna","10","Entire home",
"Jeyamani Villa","6","Entire home","4.67"
"AY Eternity Villa with nature all seasons","4","Entire home",
"Neems Paradise guesthouse","4","Entire home",
"Farmhouse in Jaffna District","2","Private room in farm stay",
"Sunflowers Canada House,  Montreal Room","2","Private room in home","5"
"Raja Nada Thiru's Villa","8","Entire bungalow",
"A Stunning, Newly Built 3-Bedroom Property to Rent","5","Entire home",
"Nature Paradise","4","Entire home",
"Sivakunjarapavanam, Keerimalai, Jaffna, Sri Lanka","5","Private room in home","4.07"
"Villa Bolgoda","10","Entire villa","4.9"
"Magical Tented Lodge in Yala- Thissamaharamaya","6","Entire chalet",
"Family Room at Beach & Bliss Mirissa 301","4","Room in hotel",
"Senthu Guest House","8","Entire home",
"Deluxe Double @Grand Ray Hotel","2","Room in boutique hotel",
"The Anam Hostel","14","Entire villa",
"Orange Bedroom","2","Private room in home","4.76"
"Pink Bedroom","2","Private room in home","4.82"
"Charming One bed Room at Beach & Bliss Mirissa 101","2","Room in hotel",
"Green Bedroom","2","Private room in home","4.67"
"""Mathura"" Home/ Double room D for rental in Jaffna","2","Private room in home",
"Hikkaduwa Beach","2","Private room in bed and breakfast",
"Luxury Villa by The Beach, Mirissa","13","Entire villa",
"Oxy breeze ella - Stay with nature Room 1","2","Private room in nature lodge","4.84"
"Private Rooms in Ella","2","Room in hotel","5"
"3BR Oasis: Remote Work Condo with Gourmet Kitchen","5","Entire serviced apartment","4.78"
"Good Lake Views","16","Entire guesthouse",
"Mayurana Villa Koggala","12","Entire home",
"All Rooms - Room `102 - Room 115","16","Private room in resort",
"Beacon By The Bay - Luxury Villa","15","Entire villa",
"Olcote in Ceylon","16","Entire home",
"Charming 6 Bedroom Boutique Hotel With Pool","14","Room in boutique hotel",
"Within 5 minutes u can go to the mt.lavinia beach","3","Private room in casa particular",
"The Salty Pelican - HIRIKETIYA - Entire Retreat","16","Entire villa",
"Leopard Glamping","3","Tent",
"The Frangipani Tree by Edwards Collection","16","Room in boutique hotel",
"Ishq Talpe","14","Entire villa",
"Four Bedroom Private Villa with Pool","8","Entire villa",
"Fully-Equipped Luxury Yacht with Full Board Meals","10","Boat",
"Perfect Beach Villa Unawatuna","16","Entire home",
"Leopard Glamping","5","Tent",
"Pinthaliya Resort & Spa, Sigiriya","16","Room in resort",
"The Alfred Digana","12","Entire home",
"5 bedroom Luxury Villa With Pool Close to Beach","12","Entire villa",
"Villa Mawella","10","Entire home",
"Ishq Colombo - City Oasis","8","Entire villa",
"Ishq Talpe - Beachfront Escape","14","Entire villa",
"11 AC Bedroom Villa - Sleeps 22, Beach front, Pool","16","Entire villa","4.5"
"Leopard Glamping","4","Tent",
"Sānti - 4 Bedroom Beach House with pool","10","Entire villa","4.2"
"Benito Bungalow- Haputale | Luxury and serenity","10","Entire home",
"Parangi Weligama Bay","16","Entire home",
"M-Beach House, Bay-front Villa","8","Entire home",
"Villa SPACE Whole villa (6 rooms) with Breakfast","12","Room in boutique hotel",
"A Luxury Villa and a Private Beach in Mirissa","6","Entire villa",
"Weli Kasba - a 7-bedroom fully staffed beach villa","16","Entire home",
"Sangria Sun Villa","12","Entire villa",
"No. 77 Leyn Baan","8","Entire home",
"Tranquil 7 BR Close To Beach in Induruwa","14","Entire home",
"On board with Ocean Dimond Mirissa Sri Lanka","4","Private room in boat",
"Leopard Cross Safari  Tours - From Sapphire Base","13","Private room in villa",
"Taru Villas Leela Walawwa with Pool View","2","Room in boutique hotel",
"villa wanderlust","2","Entire serviced apartment",
"Heritage Luxury Walauwwa","4","Room in boutique hotel",
"Villa SPACE Whole Villa (6 Rooms)","12","Room in boutique hotel",
"Your comfort","8","Entire home",
"Esperanza Beach Villa - Tangalle","13","Room in hotel",
"The Six Midigama","8","Room in hotel",
"62nd floor apart with sea view","6","Entire rental unit","4.45"
"Luxury Villa In Ahungalla","9","Entire home",
"The Manor Colombo","8","Private room in bed and breakfast",
"Leopard Glamping","1","Tent",
"4 Bed Rooms Villa  Nuwara eliya","8","Entire home",
"8 Bed Rooms Villa Nuwara eliya","16","Entire home",
"Rest house in siyambalanduwa","4","Entire home",
"Comfy Cottage in the Cool Climes of Kandy-3-Bed","8","Entire cottage",
"""Parawa House"" Six Bedroom Villa","16","Entire home",
"5BR Beach Villa Atulya","15","Room in boutique hotel",
"Blue House In Habarana","16","Entire home",
"5 Bedrooms Villa In Hikkaduwa","11","Entire home",
"Entire 16 Room Villa | Exclusive Offer","16","Room in boutique hotel",
"Perfect 5 beds Villa  Balapitiya","10","Entire home",
"Luxury Bunglow In Nuwara Eliya","16","Casa particular",
"8 bed-room beach front villa in Galle","16","Entire home",
"Luxury Cottage In Nuwara Eliya","12","Entire home",
"Lighthouse Ahangama","16","Entire home",
"The Best Valley In Beragala","16","Entire home",
"8 rooms villa in Mirissa","16","Entire home",
"Antiqe Luxury Villa in Bentota","16","Entire home",
"Green Chalets Galle","16","Entire cabin",
"3 Bed rooms Villa In Kandy","8","Entire home",
"Deco On 44","15","Room in boutique hotel",
"Peace Ful Villa In Kandy","12","Entire home",
"Privet Beach Front House Nico","8","Entire villa",
"Leopard Glamping","2","Tent",
"The Retreat House","10","Entire villa",
"Villa With a Pool In pinnawala","12","Casa particular",
"Mount view Villa with 6 bed room","14","Room in boutique hotel",
"Beach Front Luxary Resort","16","Entire villa",
"villa","3","Private room in villa",
"KAJU GREEN Eco lodges (whole property)","14","Private room in nature lodge",
"Villa in Yala","13","Entire home",
"Beachfront villa experience in Thalpe","10","Entire home",
"Guest House Surfing Villa","13","Private room in guesthouse",
"Beach front Villa in Pasikuda","16","Entire home",
"Antique Luxury Villa in Bentota","16","Entire home",
"Fort Square Villa","13","Entire home",
"Ceylo Villas, Bentota","15","Room in boutique hotel",
"The Sandals by Edwards Collection","10","Room in boutique hotel",
"Beach Villa at The Max Wadiya Boutique Hotel","8","Entire villa",
"Serenus Botiqe Villa","15","Entire home",
"Boutique Hotel with Pool & Beach - Unawatuna","16","Room in boutique hotel",
"The Max Wadiya Boutique Hotel Suite","2","Room in hotel",
"Brzio Hotel Weligama","2","Room in hotel",
"3 Sisters Beach House - Full Villa","8","Entire villa",
"Luxury Four Bedroom Villa with Private Pool","8","Entire villa",
"Ocean villa with stunning location","10","Room in boutique hotel",
"Dendrobium House, large villa near Kandy","13","Room in boutique hotel",
"Cheerful 4 bedroom villa with pool and sea access","8","Entire villa",
"Luxury Four Bedroom Villa with Private Pool","4","Room in boutique hotel",
"Bougainvillea Retreat stunning 8 BR close to Kandy","16","Entire home",
"Luxury Heritage Four Bedroom Walauwwa  with Pool","8","Room in boutique hotel",
"Thambili House by Edwards Collection","6","Room in boutique hotel",
"55Sqm room with Plunge Pool","3","Room in hotel",
"Luxury and Privacy on Mirissa Beach","6","Entire villa",
"Four Bed Room Luxury Walauwa with Private Pool","8","Room in boutique hotel",
"Beach paradise for amazing value","12","Entire home",
"On The Rocks -  7 Bedroom Beach Front Villa","14","Entire villa","4.8"
"Luxury Heritage Walauwa with Private Pool","8","Room in boutique hotel",
"Kirana - A Santani Villa","12","Entire villa",
"Beautiful Beach Villa - perfect for kitesurfing","12","Entire home",
"Lily Pod, Bolgoda","10","Entire villa",
"BougainVillea Retreat, Kandy - Main House","10","Entire home",
"5 Bedroom Luxury JH Villa","12","Entire home",
"Making Paradise Home. 6 Bedroomed Beach Villa","12","Entire villa",
"The Cavern, Luxury 3-bedroom cave stay","6","Cave",
"Superior Room with outdoor area in Habarana","2","Room in hotel",
"Victoria","10","Entire villa","5"
"Villa Lé Maas Tota Koslanda - Entire Villa","10","Entire villa",
"Skye House","14","Entire villa",
"South Point Ocean - 8 bedroom Luxury Beach Villa","16","Entire villa","4.56"
"Ishq Colombo","8","Entire villa",
"Pointe Sud clifftop villa, ocean views, beachfront","10","Entire villa",
"Luxury Four Bedroom Private Villa with Pool","8","Entire villa",
"Beach front villa Talpe, Galle, Sri Lanka.","8","Entire villa","4.9"
"Luxury Beach Villa for 6","6","Room in boutique hotel",
"Four Bedroom Private Villa with Pool","8","Entire villa",
"Villa In Galle Fort","9","Entire home",
"Maliga House hilltop villa, gym, pool & chef","8","Entire villa",
"Tea Tree Villa","12","Entire villa","5"
"Villa Serendipity","10","Entire villa","5"
"Stella Beach Villa","10","Entire cottage","4.9"
"Braganza House","8","Entire villa",
"Unwind In Style at This Beautiful Beach Front Property","16","Entire home","4.94"
"Halala Kanda – Luxury Private Villa & Estate","12","Entire villa","5"
"Claughton House","14","Entire villa",
"5 bedrm beach front villa, surf, pool, chef","12","Entire villa","5"
"Villa in Mirissa 3BR with Breakfast Infinity View","7","Entire villa","4.92"
"Luxury Mirissa Villa - Fully Staffed","12","Entire villa",
"12 Bed Rooms Villa Arugambay","16","Entire home",
"Secluded beachside house with pool and seaview","12","Entire home","4.97"
"Sihina","10","Entire villa","5"
"Beachfront villa for 10 guests with private Chef","10","Entire villa","4.96"
"Thalpe House, Galle, Sri Lanka","15","Entire villa","4.83"
"Bougainvillea Retreat a Stunning 8 BR near Kandy","16","Entire home",
"Koddu Kalpitiya Luxury Getaway","14","Room in hotel",
"3 BeachFront Villas, 3 Pools 18 rooms, Sleeps 37,","16","Entire home","5"
"Villa 99","4","Entire villa","4.65"
"7 bedrm beach house, roof terrace, pool, chef","14","Entire villa","5"
"A Private Slice Of Paradise - Mirissa, Sri Lanka","12","Entire villa",
"Maliga Kanda hill top, pool, gym & chef","14","Entire villa",
"Stunning Tekanda Lodge near Ahangama","2","Entire villa",
"Ranawara","14","Entire villa",
"mountain waterfall view","3","Private room in bed and breakfast",
"Aarunya Nature Resort and Spa-Entire Resort","16","Room in boutique hotel",
"Absolute beachfront villa, Thalpe Sri Lanka","10","Entire villa","4.92"
"Walatta House 3 bedrm beach pool chef","6","Entire villa","4.92"
"Glasshouse Kandy - Luxury 4 Bedroom Villa","8","Entire villa","5"
"Live the dream at Dragonfly","8","Entire villa","5"
"Samudra Beach Front Luxury Private Pool Villa","6","Entire villa","5"
"Valhalla villa - Madiha","10","Entire villa","4.88"
"Villa Sea Esta, Beachfront Villa, Wadduwa","8","Entire villa","5"
"Kumbura family villa, pool, cook, lovely views","8","Entire villa","5"
"Kumara Luxury Villa","8","Entire villa","5"
"Villa Tranquil Waters","6","Entire home",
"Bayagima","12","Entire villa","5"
"The Boat House Dikwella Hiriketiya/Chefs and staff","8","Entire villa","5"
"Ceylon House luxury 5 bed ocean front villa","10","Entire villa",
"August Beach House - Weligama","9","Entire home","4.96"
"Lavish pool villa in Thalduwa","12","Entire home",
"Luxury Heritage Walauwa with Private Pool","8","Room in boutique hotel",
"Villa Abiman - beachfront villa near Dikwella","10","Entire villa","4.98"
"Stella Antique Villa","14","Entire villa","5"
"Luxury Villa: Huge Infinity Pool, Amazing Views","16","Entire villa","5"
"Villa Seeni 243","11","Entire villa","4.94"
"Boundary House. 4 bedrm villa with private Chef","8","Entire villa",
"Luxury Beach Front Villa Olu, Galle","8","Entire villa","4.84"
"Tropical Group Oasis: Luxury","8","Room in hotel",
"Villa Salina - Luxury Beach Villa","12","Entire villa","4.83"
"Real Royalty-:Seawater Pool&Direct Beach Access","10","Entire villa","4.93"
"Boutique villa with infinity pool","8","Entire villa","5"
"Suduwella House","8","Entire home",
"Luxury Villa Ahangama Sri Lanka","10","Room in boutique hotel",
"Private Luxury beachfront villa in Weligama","10","Entire home",
"Mandalay  Lake side, 3 bedrms, pool & chef","6","Entire villa",
"Old Clove House","16","Entire villa","4.97"
"Siri Wedamadura - luxury villa in Mirissa","8","Entire home",
"Soul House Luxury Private Villa","10","Entire home","5"
"Home... for Long stay","2","Entire bungalow",
"South Point Villa - 3 bedroom beachfrontvilla","8","Entire villa","4.83"
"Zen House
a Boutique Hideaway","11","Entire villa",
"Arugambay Bilss Entire Place","16","Entire home",
"Old Clove House - 2 Bedrooms","4","Entire home",
"The Divine Villa","12","Room in boutique hotel",
"Old Clove House (3 bedrooms)","6","Entire home","5"
"Secluded Beach front Villa > Bed and Breakfast","8","Room in boutique hotel","4.91"
"Ocean front villa with private swimming pool.","10","Entire home",
"Waters Spring Hotel","12","Entire home",
"Nisala Arana Bentota, A Private Villa","16","Entire villa","4.83"
"Tudor Barn - Little England Cottages","10","Entire villa","5"
"Luxury Beachfront Villa in Hikkaduwa - Villa 46","10","Entire villa","5"
"Casa MiJa: Boutique Beach Front Villa Near Mirissa","14","Entire home","4.68"
"7BR Colonial Property w/ Pool + Serene Lake View","14","Entire villa","5"
"Riverside jungle villa sleeping 8 with pool","8","Entire villa",
"Signature Suite at Bougainvillea Retreat Kandy","2","Entire home",
"Ivy Beach - Private Beach front Villa (24 pax)","16","Entire villa","4.57"
"Bellini Blue - Beach-front Villa with pool","5","Entire villa",
"The RIV - Eco Mountain Villa","6","Shipping container",
"Jasper Leopard wilpattu","10","Entire bungalow","4.67"
"Saffron & Blue, 4BR, Bentota w/ chef","8","Entire villa",
"Olanda Beach House - Beachfront Villa in Talpe","10","Entire villa","4.37"
"Old Clove House","14","Entire villa","5"
"Araliya Beach House","8","Entire villa",
"On The Rocks -3 Bedroom Beachfront Villa","6","Entire villa","5"
"Celadon House, ocean views, chef, on the beach","10","Entire villa",
"Sulanga - Luxury Chalet","15","Entire home",
"Spectacular Koggala Lake view! Sea Heart House.","8","Entire home","4.86"
"IF Villa 10 beds (5 rooms) on Beach front","10","Room in boutique hotel",
"41 Lighthouse Street","6","Entire villa",
"Floating Villa with Full Board","2","Private room in boat",
"The Weir House - Vacation on a Spice Estate","10","Entire villa",
"THE LOVING LEOPARDS @ FLAME TREE ESTATE & HOTEL","2","Room in boutique hotel",
"Saffron & Blue, 3BR, Bentota w/ chef","6","Entire villa",
"30 Sqm Seaview room in Galle","3","Room in hotel",
"Luxury Beach Villa with your privacy","8","Entire villa",
"Subashri Villa -","16","Entire villa","4.89"
"906 Private Villa on the Beach","5","Room in hotel",
"Arhimser-Superb beach villa for 8, Ranna, Tangalle","8","Entire villa",
"Villa 32 Middle Street Galle Fort","6","Entire villa","5"
"Luxury Camp - Ceylon Wild Safaris","3","Campsite",
"Owl and the Pussycat Hotel (Galle) -Signature 2BHK","4","Room in boutique hotel",
"Luxury Apartment in Colombo","8","Entire rental unit",
"Kurokawa Kalutara","12","Entire home",
"Yala Lake View Cabanas","6","Tent",
"Kambura Villa Mirissa","12","Entire villa","5"
"Mirissa Group Luxury Ocean Views","6","Room in hotel",
"Dream Beach Villas Ambalangoda / Oceanfront","12","Entire villa","5"
"Tea Heights","6","Room in boutique hotel","5"
"The Cottage 43 - Viceroy House","2","Room in boutique hotel",
"Suite with Outdoor Bathtub","2","Private room in home",
"Luxury Private Suite Room, Beach Front","2","Private room in villa",
"THE PANTHERA YALA - Luxury Tent 02","2","Campsite",
"6BR Old Colonial Villa in Adams Peak","10","Entire villa",
"Oba Samanga","8","Entire villa",
"Sulanga - 3 BR Luxury Chalet","6","Entire home",
"9Provinces_boutique Galle
Entire Villa","16","Room in boutique hotel",
"“Cinnamon Serenity Villa”","15","Entire home",
"Luxury Colonial Villa","14","Entire villa",
"Ambalama Villa Sri Lanka","10","Entire villa","5"
