"name","numberOfGuests","roomType","stars"
"Beach Front,  Garden View Room - Solas Surf","3","Private room in bed and breakfast",
"Peaceful 2 bedroom apartment with 2 bathrooms","5","Entire home",
"Green Room (LaLa Villa)","2","Private room in home",
"Twenty Two Dazzle Bay","3","Room in hotel",
"RH3 Family Room for 4 at Katunayake","4","Private room in home",
"New Summer Vacation (Two)","2","Entire rental unit",
"Mount Rest Villa","2","Entire home",
"Bee Line - Blue View","3","Private room in rental unit",
"Araliya Villa","6","Entire home",
"OLU AYURVEDA BEACH RESORT - Standard Double Room","2","Private room in bed and breakfast",
"AMFA Apartment","5","Entire rental unit",
"Orange Room","2","Room in hotel",
"Kirindi Haven Guesthouse","4","Entire home",
"Heights Retreat - Galle - Room 2","2","Private room in home",
"studıo delux","2","Entire rental unit",
"Arabella on Boossa King room with mezzanine lounge","2","Room in boutique hotel",
"Vidushi Home","12","Private room in villa",
"Binara Home Stay (Tourist Lodge)","9","Private room in home","4.73"
"*FEMALE ONLY SHARED ROOM - Yoga & Surf, HIRIKETIYA","16","Shared room in boutique hotel","4.5"
"Neverbeen to Sigiri Sky Treehouse | Entire Chalet","4","Treehouse","5"
"ASK Homestay (With free Heating Facilities)","2","Private room in home","4.49"
"Isana Beach House Room 3 Nami","2","Private room in bed and breakfast","4.5"
"Hotel Southern Blue Sapphire Deluxe Double Room 6","2","Room in hotel",
"Family Suite","4","Private room in resort",
"Beautifully furnished cozy bedroom with two beds","4","Private room in villa","4.67"
"SAGA  HOME spacious family room","4","Private room in townhouse","4.75"
"Ella Rock Lands'","4","Private room in bed and breakfast","5"
"Colpetty House - Sky Penthouse","2","Casa particular","4.5"
"Garden Chalet Two","4","Private room in bungalow",
"Lovely & calm vacation home in Galle","2","Entire vacation home",
"Kevzz -  A luxury Villa","6","Entire home",
"SC Galle with Pool / GZ 1","2","Private room in bed and breakfast","4.58"
"beach_TRIGON 1 / tinyhouse / co_living","2","Entire home",
"Golfers' Paradise Kahathuduwa.","4","Private room in rental unit",
"New Green View","2","Private room in guesthouse","5"
"Kuwera Kandy","2","Room in hotel",
"Wind Blend Lagoon Cabana","2","Private room in cabin",
"villa 58 unawatuna.","5","Entire rental unit",
"Kayjay Beach front","1","Room in hotel",
"Happy Stay Cottage","6","Entire guesthouse",
"Luxury apartment in Colombo 07","10","Entire condo","5"
"Villa Lotus in hikkaduwa (25% discount)","2","Private room in villa",
"Spacious 3 BR villa near Hikkaduwa beach paradise","6","Entire villa",
"Standard Double room in MOI Ella by DBI","2","Room in hotel",
"FICUS CANOPY - TREEHOUSE KANDY","2","Treehouse","5"
"Cozy 2 BR Villa with Ayurveda near Tangalle","6","Private room in nature lodge","4.57"
"Daffon Villa Guest House","13","Private room in villa","4.79"
"DONA 26 situated at Digana","4","Entire home",
"AC Apartment with bathroom & Pantry","2","Entire rental unit","5"
"Bella Nilaveli Beach","4","Private room in bed and breakfast","4.57"
"Villa Eden Paradise","5","Private room in villa","4.69"
"La monatagna Resort -comfortable  mount view rooms","2","Private room in guesthouse",
"Truely a Beach Home Away from Home","6","Entire condo","4.7"
"Monsoon eco resort -Sunset cabana","4","Entire cabin",
"The Coconut Tree Villa","6","Entire villa","4.67"
"Capital TRUST Residencies Colombo 05","6","Entire condo",
"Charming 2 storey garden villa","4","Entire villa","4.81"
"Bouncer's Place
Chiara / 2 apartment house","2","Entire home","5"
"Sri Lankan yoga and Accommodation in Hostel.","2","Room in serviced apartment",
"Knuckles Misty Holiday Bungalow","4","Room in boutique hotel",
"VV - Double deluxe 1","2","Private room in guesthouse",
"A 4 bedroom villa nestled in the hills of Galaha","10","Entire villa",
"Vibrations Villas - Deluxe Double Room (2)","2","Private room in guesthouse",
"SAGAHOME R.10 Large Rm, private balcony & bathroom","2","Private room in home","5"
"Chanya Luxury Apartment, S1, Lake View Residencies","6","Entire rental unit",
"Skyscraper apartment with pool","6","Entire rental unit",
"Nagenahira Beach Villas  The Tamarind Tree Suite","2","Private room in bed and breakfast",
"Standard Double Room","2","Entire home","4.63"
"unique and beautiful house","2","Private room in home",
"Sea view apartment for rent","5","Entire rental unit","4.33"
"Two Bedroom Apartment with a Pool","4","Entire rental unit","4.33"
"Misthill Rest - Deluxe Double Room - 205","2","Room in boutique hotel",
"Watergate-Bolgoda","2","Private room in resort",
"Chalet 07","2","Private room in bed and breakfast",
"Heros Villa Mirissa","10","Entire villa","4.94"
"Paper Moon Kudils - Restaurant Side","2","Room in hotel",
"Captain's Cottage at Yala","10","Entire vacation home",
"The Forest Villa and the waves wait for you!","2","Private room in guesthouse","4.64"
"Isanka lion lodge","9","Private room in home",
"Grandiose Fairway Apartment Galle","6","Entire condo","4.7"
"King Room with Mountain View","2","Room in hotel",
"Home in the heart of Arugambay","3","Tiny home",
"Villa 61 Wewaldeniya","6","Entire villa",
"Beach Club Apartments - Thal","3","Entire rental unit",
"Deluxe Villa With Garden View Double Bed & Breakfast","4","Room in boutique hotel",
"Garden Chalet One","4","Private room in guest suite",
"Green Leaves Mud Chalet","4","Entire bungalow","5"
"Holiday Apartment Galle, Richmond Hill Residencies","5","Entire rental unit",
"Lake View Serenity - Serendipity Lake","2","Private room in nature lodge",
"Lanka villa mirissa (private villa “6 bedrooms”)","13","Entire villa","5"
"Deluxe Double Room with Free late Check Out","2","Room in boutique hotel",
"Villa Mandala Colombo Amazing 4BR Villa","8","Entire home","4.9"
"Amarelo Residence","6","Entire villa",
"Arabella on Boossa Twin Room","2","Room in boutique hotel",
"Jasmine Villa Part of Blackpool","4","Entire rental unit",
"Tropical Garden Holiday Homes right on the beach","10","Entire villa","4.75"
"Makahiya Fitness, Core Room","2","Room in hotel",
"3BR Private Pool Premium Villa - Colombo","10","Entire home",
"Rainforest view room in Luxury Manor","3","Private room in home",
"1 BD luxury villa Galle private pool and jacuzzi","2","Entire home",
"One Bedroom Apartment","2","Private room in rental unit",
"Dream vacation","2","Barn",
"Superior Twin Deluxe at Seerock The King's Domain","2","Room in hotel",
"Freedom palace","10","Entire villa",
"stylish river front villa Madampe House","7","Entire home",
"Hidden Paradise","2","Entire vacation home",
"Budget Cozy Apartment Colombo","4","Entire rental unit",
"a beautiful bangalow in the hills","2","Private room in bed and breakfast",
"Sea Esta","6","Entire villa",
"Serendivi Resort Villa - Tangalle","2","Private room in home",
"Mandala Villas 1","2","Entire villa","4.67"
"Haldummulla Estate - the Library Suite","2","Entire chalet",
"Premium Deluxe Room at Seerock The King's Domain","2","Private room in resort",
"Charming couple bedroom with pool and garden view","2","Room in hotel",
"Villa Allunga","4","Entire villa","4.33"
"Nagenahira Beach Villas Ocean View Suite","2","Private room in bed and breakfast","4.5"
"""Sundari"" The Romantic Suite","2","Room in boutique hotel",
"Romance Sky 4","2","Private room in nature lodge","4.38"
"Comfortable and well located","2","Entire home",
"Orchid 2 Apartments","6","Entire rental unit","5"
"DCC Penthouse Apartment Double Bedroom","2","Private room in rental unit",
"Family room in the mountains near Kandy","4","Private room in bed and breakfast",
"Galle Fort Mango House Double Room With Courtyard3","2","Room in boutique hotel",
"Sweet Cinnamon Serenity","2","Room in boutique hotel",
"Executive Bungalow near Colombo Airport","8","Entire home","4.71"
"Tangalle Serenity Bungalow","8","Entire home",
"COCOYA","4","Entire bungalow","5"
"Villa Steps Away from the Beach","4","Entire home","4.67"
"DK Green Villa,Madiha Surf Point","2","Tiny home",
"Stay in Paradise- Wellawatta","4","Entire home",
"O2 Villas-Mirissa Two Double Rooms","4","Entire villa","5"
"Kalaniya River, Kalaniya temple , Leisure world","6","Entire rental unit",
"LankahutsVilla Rooms","2","Private room in home",
"Luxury Apartment  in Colombo","4","Entire rental unit",
"Stunning Beach Side Boutique Hotel Rooms","6","Room in hotel",
"Charming bedroom for 6 in Ibbagamuwa","6","Room in boutique hotel",
"Luxury Boutique Hotel In Unawatuna Near The Beach","16","Room in hotel","4.5"
"Beautiful Villa 
Colombo North, Pool, Airport","6","Private room in villa",
"Cozy Ensuite Room, Few step to Beach/Surf Weligama","2","Private room in villa",
"""OCEAN HOME"" Condo is located in the City of Galle","6","Entire condo","5"
"Arabella on Boossa King room, garden & sea views","2","Room in boutique hotel",
"Room 106 - Double Room","2","Room in hotel",
"3 Bedroom Villa","6","Entire villa","4"
"Glorious Nature Inn-Room 02","2","Private room in bed and breakfast",
"Tropical garden suite with AC","3","Room in bed and breakfast","4.94"
"COCOYA","2","Private room in bungalow","5"
"Villa 35F at Galle
Two large bedrooms & bathrooms","4","Entire villa","4.8"
"Double room-Deluxe-Ensuite with Shower-Sea view","3","Private room in villa",
"Capital TRUST Residencies Colombo 04","6","Entire rental unit",
"Silversand seaside transit hub","2","Entire home",
"Green Lake View Condo G8","5","Entire rental unit",
"PALM VILLA MIRISSA, AC room N21 for 5 ocean view","6","Room in boutique hotel","4.75"
"Mountain Top Glamping Suite with a Star Bed","4","Private room in tent",
"Oshi Villa close to turtle beach","4","Entire rental unit",
"Queensberry Room at Tea Library","2","Private room in bed and breakfast",
"Two bedroom pool villa with sea view","4","Entire villa",
"Villa Paradise Private room A/c beachfront","2","Private room in bed and breakfast","5"
"Home In the heart of Kurunegala City.","8","Entire home",
"Sarah Cottage - Ginger room","2","Private room in cottage","4.55"
"Water Front City Villa","9","Entire villa","5"
"""On Golden Mile"" by Swarg","6","Entire rental unit",
"Pivithuru River Cabanas -Full","6","Room in hotel",
"Village experience in private room with breakfast","2","Private room in guesthouse","5"
"Deluxe Rooms At Ilukketiya","4","Room in hotel",
"Nest Villa","6","Entire home",
"OASIA Family villa","9","Entire home",
"AMA VILLA FAMILY ROOM","4","Entire villa","4.86"
"Pedlar Street A/C twin in C17th villa with pool","2","Private room in home",
"Peacock Beach Resort & Spa - Double/Twin Room","2","Room in hotel",
"Beach Mount Apartment","6","Entire rental unit","4.52"
"Field View House Ahangama","2","Entire home","5"
"sajee place","4","Entire home",
"Adare Beach Villa 61, Private Luxury Rooms","2","Private room in villa",
"Deluxe Double - Free tuk to Galle fort, BB & AC","2","Private room in home",
"Luxury apartment with a view, Galle","4","Entire rental unit","4.83"
"Coconuts room / French Swallow villa / Ahangama","2","Private room in bed and breakfast","5"
"The Dale Mirissa, Deluxe Double Room","2","Private room in bed and breakfast",
"Rajadhani Rest ( THE KINGDOM) Anuradhapura","15","Private room in home","4.76"
"Voulez-Vous. Kids Friendly Garden Beach Style !","3","Room in hotel",
"Club Waskaduwa Beach Resort","2","Room in hotel",
"Deluxe King Suite with Balcony","2","Private room in bed and breakfast",
"Dunwatta House","6","Entire home",
"Glenrose.Private Room #2","2","Private room in villa",
"Lighthouse Guest - Colonial stay in Galle Fort","2","Private room in guesthouse","4.76"
"Sunnyside Luxury Home","2","Entire home",
"Easy access to more conveniences nawala","6","Entire rental unit","5"
"Breeze villa","6","Entire villa","4.45"
"New Summer Vacation (One)","2","Private room in guesthouse",
"Nayan's Paradise Sea Deluxe Room","2","Entire bungalow",
"Villa Toscana: Tranquil Retreat in Weligama","12","Entire home",
"Galle Vacation F2 ( Hot water shower )","2","Private room in home",
"Coastal Comfort - Villa Berlin","4","Entire guesthouse",
"Asiri Homestay","3","Private room in bed and breakfast",
"Still Waters-A Cottage byTheLake","4","Entire home",
"River side Guest & Travels new","2","Private room in home","4.57"
"Villa GOYA.m, Ap1","2","Private room in villa","5"
"Sigiri Chandi Homestay","5","Private room in guesthouse","4.95"
"Villa with private garden","8","Entire home",
"Sea Yo Villa - 2-Bedroom Villa - Hikkaduwa","4","Entire villa","5"
"Dream Garden - Deluxe double AC studio w/ bedroom","2","Room in boutique hotel",
"Great Yeheni Villa - Room 1","2","Private room in rental unit","4.67"
"Birds Nest Rajagiriya","5","Entire condo","4.92"
"Villa Hilltop by yehansa wit unlimited fiber Wi-Fi","7","Entire home","4.63"
"Casa Mira - Upstairs Apartment","2","Entire home",
"Canterbury Lexus Golf Apartments","4","Entire rental unit",
"Brand new double room with A/C","3","Private room in bungalow",
"Aqua Exotica - River View Chalet","2","Room in hotel",
"South House - Weligama","2","Private room in bed and breakfast","5"
"beautifuly designed house","2","Private room in home",
"Villa Sunrise, room 1 with beach access","3","Private room in villa",
"C1 Hostel - Private Twin Room","2","Private room in hostel","5"
"Camellia Rise","9","Entire villa","4.67"
"Charming Garden Villa near Beach","4","Entire villa","4.82"
"Galle Vacation F1 ( hot water shower )","2","Private room in home",
"Zodiak guest house 4","2","Room in hotel",
"Bright Home Stay","4","Entire guesthouse",
"Escape to Balapitiya | Villa Tranquilo + Boat ride","6","Entire home",
"Coconut Room Aircon with Jungle View","2","Private room in rental unit",
"Villa Morawala, Negombo","2","Private room in home",
"Araliya New","4","Entire rental unit",
"Oven's home stay – upstairs apt","2","Entire rental unit","4.71"
"Chambre familiale proche du jardin botanique","4","Private room in bed and breakfast",
"Beach furnished private apartment","2","Entire rental unit","4.71"
"King Room with Mountain View","2","Private room in bed and breakfast","4.57"
"Bora Bora Amore Villa","6","Entire villa","4.67"
"Lake View,Two Double bedrooms # kitchen#A/c ,wifi","4","Entire rental unit","5"
"BeachBay Villa","4","Entire home",
"On320 Two BR Full Apartment","4","Entire rental unit",
"Nelma's Cosy Luxury Home. Centrally Located","6","Entire rental unit",
"Monkey Camp - Hanuman Bungalow - Dushy","4","Private room","4.64"
"Moorthy villa guest house","8","Entire home",
"Budget Double room","2","Private room in villa","4.5"
"The Triple Room with City View","3","Private room in bed and breakfast",
"Akane Quad BB","4","Room in boutique hotel","4.8"
"The Lair Kandy","2","Private room in home",
"Condo in the heart of Colombo with all amenities","4","Entire condo",
"Samadhi Earth Home","2","Earthen home",
"Ocean Breeze Negombo Aparthotel","2","Entire rental unit",
"Alai Mullaitivu","2","Room in hotel",
"Dreams Garden Midigama - (3 Bedrooms Apartment)","6","Entire home","4.95"
"Villa 105B – Elephant Room","2","Private room in guesthouse",
"Appartment Elixia 3cs-Colombo,Malabe","4","Entire rental unit",
"Saranja Holiday house","6","Entire home","5"
"Glamping Safari Tent near Yala National Park","2","Tent",
"Villa Tranquilo - Balapitiya","6","Entire cottage",
"Kedalla","6","Entire home",
"Gal Oya Lake Club Luxury-Rose Tent","2","Tent",
"Mango Room with Air-con","2","Private room in rental unit","5"
"""The Aganuwara"" by Swarg","6","Entire rental unit","5"
"Seacoast Sanctuary Beach Hotel - Triple room","3","Room in hotel","4.67"
"Tree house with mountain view","2","Treehouse","4"
"Sea view Tree House - Hiriketiya","2","Private room in cabin",
"Dune Towers - family suite, bath, 2xterrace","4","Room in boutique hotel",
"Colombo 9 - 3BR Fully furnished Apartment","6","Entire condo","4.67"
"New Walawwa Villa Ahangama","4","Entire home",
"Star Gaze Lodge","2","Private room in home",
"lovely room in amazing house","2","Private room in home",
"Nagenahira Beach Villas - Garden view villa room","2","Room in boutique hotel","4"
"The Lotus - 15min away from Kandy City","4","Entire home","4.9"
"Ginganga Lodge (Ginger or Heliconia Room)","2","Private room in bed and breakfast",
"Fika House Galle","5","Entire home",
"Tea Plantation Bungalow In Galle","2","Tiny home",
"DK Green Villa,Madiha Surf Point","2","Tiny home",
"Deluxe Room @ Lion's Rest Weligama","4","Room in boutique hotel",
"Luxury Room 01 by Arsulana","2","Private room in nature lodge",
"Sweet Cinnamon, Kandy","2","Room in boutique hotel","5"
"Swarg Baththaramulla -3BDR/2BTH Ful/ Furnid Aptmnt","6","Entire serviced apartment",
"Chacha Villa - Cozy nook by the sea","4","Entire home","4.3"
"Go Outdoor Wilpattu Caravan Park","3","Private room in camper/rv",
"Casa Heliconia - Pagoda Suite","2","Private room",
"Orchid 2 Apartment","6","Entire rental unit",
"Deluxe  Double","2","Private room in villa",
"Orchid 2 Apartments","6","Entire rental unit",
"Venue Colombo- luxury city hotel","2","Private room in bed and breakfast","4.75"
"GS Nirbana River Suite Open Bath King Size Bed","3","Room in boutique hotel",
"2 Bedroom Delight! Come for a night, stay a week!","4","Entire rental unit","4.71"
"Bethel Rest Homestay / Deluxe Quadruple","4","Private room in bed and breakfast",
"ORA Luxury Villas Hikkaduwa","4","Entire home",
"The Courtyard Villa Sigiriya Entire Villa","7","Room in boutique hotel","4.71"
"Unrushed Midigama- Entire villa","9","Entire home",
"Bedroom B- in 3 Suite Boutique Hotel - The Summit","2","Room in boutique hotel",
"Superior Deluxe Room at Seerock The King's Domain","2","Private room in resort",
"White Water Rafting & Accommodation - BB","16","Private room in tent","4.47"
"The Grace Beach House","6","Entire villa","4.83"
"Misthill Rest - Deluxe Triple Room - Nuwaraeliya","3","Room in boutique hotel",
"Villa Kumbuk by Arsulana","2","Tiny home",
"River splendor Deluxe Family","4","Private room in bed and breakfast",
"Lovely 2 Bedroom apartment with luxury facilities","4","Entire condo",
"Your green adventure starts here","16","Room in hotel",
"Villa Fiorí~Twin Deluxe Rooms (12% Discount)","4","Private room in villa",
"Green Park  house  5 AC Rooms.","10","Entire home",
"Beautiful Seaview double room","2","Private room in guesthouse",
"Luxury Aircon 2 or 3 bedrooms Condo in Colombo","6","Entire condo","4.4"
"Stylish bungalow in the heart of Bird Sanctuary","2","Private room in bed and breakfast","4.67"
"Paradise Residence Hanthana","9","Entire villa",
"Luxury Beach Villa in Talpe | Violet's Beach House","7","Entire villa",
"Treasure apartment Colombo","6","Entire condo","4.8"
"Galawatta Beach Villa","9","Entire condo","4.44"
"Deluxe Triple room with balcony and mountain view.","3","Private room in villa",
"Aminva BoutiqueVilla~ 30% Discount -FULL Property","10","Entire villa","4.77"
"Edmon Beach Villa","6","Entire home",
"Ninety-Nine Apartments","4","Entire vacation home",
"Riverine Cascade","6","Entire home","4.86"
"A Peaceful Hideout","2","Entire vacation home",
"Comfy stay to be one with Nature","2","Dome",
"""Beach Haven Nilaveli""  a home away from home","6","Entire condo","5"
"Unrushed Ahangama- Courtyard facing Double Bedroom","2","Private room in villa",
"Grand Beragala Boutique Resort","3","Room in hotel",
"Unrushed Ahangama- Courtyard facing Double Bedroom","2","Private room in villa",
"Dennislandvilla-Araliya","4","Entire rental unit","5"
"Heaven on Earth - Sea View","6","Entire rental unit",
"Mandala Villas 3","2","Entire villa",
"ABBA'S Mountain Villa","6","Entire villa","4.41"
"Cozy Deluxe Seaview Room | Pool | Beach","2","Room in hotel",
"Villa Aanya Hikkaduwa","6","Entire villa","4.88"
"Wonder 5A","5","Entire rental unit",
"Sea-view luxury room in Negombo","2","Private room in home",
"A Hidden Gem in the Tropical Paradise","6","Entire home","5"
"Fun-Ocean-Chill","2","Entire rental unit",
"Cabin 7000 feet - Nuwara eliya","8","Entire cabin",
"Deluxe Room @ Lion's Rest - Weligama","4","Room in boutique hotel",
"Charming Property with a Pool","2","Entire home",
"GOOD STORY ANITYA VILLA","6","Entire villa","4.75"
"Apartment near the Polhena beach","5","Entire rental unit",
"Yala Eco-Friendly Retreat in the Heart of Nature","2","Entire cabin",
"The Little House - Hiriketiya","2","Entire home",
"La HAVEN","2","Private room in bed and breakfast",
"Mandala Villas 2","2","Entire villa",
"Prince of Galle Hotel - Queen Suite - Room 1","2","Private room in home","4.75"
"Bungalow & swimming pool - Group","10","Entire home",
"Park lane Retreat
2 Bed Room","4","Entire rental unit",
"Studio cottage w/ pool access","2","Entire cottage",
"The Glade","2","Entire rental unit",
"Villa Sublime Standard King Room","2","Private room in bed and breakfast",
"Tropical Paradise","2","Entire vacation home",
"Villa Raffaello","6","Entire villa","4.74"
"Wadula Safari - Yala (Cottage Number 03)","3","Room in boutique hotel","4.86"
"Sea esta mountlaviniya","6","Entire villa",
"Eton villa","8","Entire villa","5"
"Artsy & Cozy Villa in Ahangama - Full House","4","Entire home",
"G09/ 3 Bedroom Luxury Apartment","6","Entire rental unit",
"Villa Four Seasons - Mirissa ( 4 bed rooms Villa)","8","Entire villa","5"
"Villa in spacious Eco Lodge, with lagoon frontage","5","Private room in nature lodge","4.55"
"Three bedroom luxury Villa.","6","Entire guesthouse",
"Central Retreat","6","Entire rental unit",
"Charming mountain cottage","4","Entire cottage","4.66"
"Treehouse deluxe","2","Treehouse","4.59"
"Hill House Villa Unawatuna Galle","10","Entire villa",
"Villa Upper Dickson - Room 3","2","Private room in villa",
"Yuhibuhi Forest Resort- Tree House","2","Private room in resort",
"sigiri lodge bed and breakfast","2","Private room in bed and breakfast","5"
"Kalahe House","8","Entire villa","4.75"
"Gal Oya Lake Club Luxury-Heliconia Tent","2","Tent",
"Ayansa Villa - 3 Bed Apartment Colombo Sri Lanka","8","Entire villa",
"Budget Triple Room/ Lakeside Hotel","3","Private room in guesthouse","4.05"
"Villa Gaetano 03 Bedrooms","6","Private room in bed and breakfast",
"Wadula Safari - Yala (Cottage Number 05)","3","Room in nature lodge","5"
"Kottukal Beach House by Jetwing","2","Private room in villa",
"3-bedroom apartment","7","Private room in condo",
"Bodi's Loft Friends - Colombo","4","Private room in guest suite",
"Joungle Tumeric","4","Private room in home",
"Lovely 2-bedroom holiday home with free parking.","4","Entire vacation home",
"Beachbums Hostel - Shared Dorm","1","Shared room in guesthouse","5"
"Wayside Cottage (Holiday Cottage in Sri Lanka)","4","Entire home",
"Villa Estuary Induruwa Benthota","2","Room in boutique hotel",
"Poomaz Family Villa","6","Entire rental unit",
"Lake Front 3-Bedroom Bungalow in Anuradhapura","7","Entire bungalow","4.47"
"First-Floor Equilibrium #1","2","Private room in casa particular",
"Deluxe Family Room with Free Late Check Out","4","Room in boutique hotel",
"Rest with BLUE ocean GREEN trees","6","Entire home",
"Villa 105B – Tiger Room","2","Private room in guesthouse",
"Experience Sri Lanka taste staying our Homestay","2","Private room in guest suite",
"Kalpitiya Diving Center ,cabana moray.","2","Private room in nature lodge","4"
"Cozy 2 BR Apartment with pool by Ceylon Vacation","4","Entire serviced apartment",
"2 Bedroom Villa","6","Entire home",
"The Pool Room @ Lion's Rest - Weligama.","2","Room in boutique hotel",
"Luxury smart private room in kandy with pool 1F","5","Private room in bed and breakfast","4.67"
"Country House A/C Double Room with Breakfast","2","Private room in bed and breakfast",
"dumi house room3","2","Private room in home","4.54"
"One double room-  1 min. walk  to Beach","2","Private room in home",
"Inspira ella. Best view and big luxury rooms","2","Room in hotel","4.86"
"The Vintage Villa - Knuckles","4","Private room in nature lodge",
"Hangarankanda Bungalow, Deniyaya","12","Entire bungalow","4.25"
"Kingsford Residences Luxury Apartment Nuwara Eliya","6","Entire serviced apartment","4.27"
"Star Sun Home Stay","2","Entire place","4.73"
"Bed in a Shared Dormitory at a Private B&B","1","Shared room in hostel","4.32"
"Single Bed in Shared Room","4","Shared room in nature lodge",
"Couples Getaway with Private Balcony","2","Private room in bungalow","5"
"Wooden Cottage With Balcony","2","Private room in cottage",
"Jungle Book Living in Comfy Tree House in Sigiriya","4","Private room in treehouse","4.81"
"Private Luxury room - 200m from the beach","2","Private room in guesthouse","5"
"Clifton House","4","Entire villa","4.77"
"Garden View - Room Only","2","Room in boutique hotel",
"Sea view beach front deluxe double+Sofa Bedroom","3","Private room in nature lodge","5"
"Whispering Palms Retreat","5","Entire home",
"Anusha Villa","2","Private room in villa","4.86"
"Avenue Nuwara Eliya_Apartment for rent","6","Entire rental unit",
"Negombo Ma Boutique Residence 02","2","Private room in villa","5"
"Hansons Homestay 3 Bedroom Apartment for 7 Guests","7","Entire rental unit","4.86"
"Ground standard room Mirissa","2","Private room in bed and breakfast",
"Standard Villa in Ella","4","Entire guesthouse",
"Budget Room In Galle Fort","2","Private room in villa","4.79"
"Deluxe Triple Room","2","Room in hotel",
"Hikkaduwa Beach House","4","Entire home","4.88"
"Spacious Apartment in Galle with a beautiful view","6","Entire condo","4.92"
"Cozy, Luxury,
full A/C, hot water & 2 bedrooms","4","Entire rental unit","4.83"
"CANDY HOME","2","Entire rental unit","4.54"
"SERVICED LUXURY APRTMNT CITY RESORT All Inclusive","4","Entire rental unit","4.83"
"Private Room in Waterfront Villa","2","Private room in home","5"
"2Bed rooms Apartment in Negombo","4","Entire serviced apartment","4.67"
"A Wooden Hideout in Noah’s Ark","1","Private room in home","4.75"
"Tree House Midigama","2","Treehouse","5"
"Apartment in Colombo 07","5","Entire condo","5"
"Urban Retreat","4","Entire condo","5"
"African Room at Emel's Retreat","2","Private room in vacation home",
"Palm villa Mirissa N°16 double room AC sea view","2","Room in boutique hotel","4.63"
